{
  "id": "trace-ordering-unknown-retains-evidence",
  "title": "Trace report preserves independent evidence when shell ordering is unknown",
  "changeType": "observability",
  "hypothesis": "A shell before capsule binding makes first-mutation ordering unknown without removing the known mutation, capsule, or validation metrics.",
  "fixture": "trace-session",
  "suite": "smoke",
  "steps": [
    {
      "command": ["$AKRCTX", "hook", "SessionStart", "--akrctx-trace", "--akrctx-host", "claude"],
      "stdin": "{\"session_id\":\"unknown-order\",\"hook_event_name\":\"SessionStart\"}"
    },
    {
      "command": ["$AKRCTX", "hook", "PreToolUse", "--akrctx-trace", "--akrctx-host", "claude"],
      "stdin": "{\"session_id\":\"unknown-order\",\"hook_event_name\":\"PreToolUse\",\"tool_name\":\"Bash\",\"tool_use_id\":\"explore-1\",\"tool_input\":{\"command\":\"ls\"}}"
    },
    {
      "command": ["$AKRCTX", "hook", "PostToolUse", "--akrctx-trace", "--akrctx-host", "claude"],
      "stdin": "{\"session_id\":\"unknown-order\",\"hook_event_name\":\"PostToolUse\",\"tool_name\":\"Bash\",\"tool_use_id\":\"explore-1\",\"tool_input\":{\"command\":\"ls\"},\"tool_result\":{\"exit_code\":0}}"
    },
    {
      "command": ["$AKRCTX", "hook", "PreToolUse", "--akrctx-trace", "--akrctx-host", "claude"],
      "stdin": "{\"session_id\":\"unknown-order\",\"hook_event_name\":\"PreToolUse\",\"tool_name\":\"Read\",\"tool_input\":{\"file_path\":\".akrctx/tasks/TASK-001-eval/task.md\"}}"
    },
    {
      "command": ["$AKRCTX", "hook", "PreToolUse", "--akrctx-trace", "--akrctx-host", "claude"],
      "stdin": "{\"session_id\":\"unknown-order\",\"hook_event_name\":\"PreToolUse\",\"tool_name\":\"Edit\",\"tool_use_id\":\"edit-1\",\"tool_input\":{\"file_path\":\"src/index.ts\"}}"
    },
    {
      "command": ["$AKRCTX", "hook", "PostToolUse", "--akrctx-trace", "--akrctx-host", "claude"],
      "stdin": "{\"session_id\":\"unknown-order\",\"hook_event_name\":\"PostToolUse\",\"tool_name\":\"Edit\",\"tool_use_id\":\"edit-1\",\"tool_result\":{\"exit_code\":0}}"
    },
    {
      "command": ["$AKRCTX", "hook", "PreToolUse", "--akrctx-trace", "--akrctx-host", "claude"],
      "stdin": "{\"session_id\":\"unknown-order\",\"hook_event_name\":\"PreToolUse\",\"tool_name\":\"Bash\",\"tool_use_id\":\"validation-1\",\"tool_input\":{\"command\":\"npm test\"}}"
    },
    {
      "command": ["$AKRCTX", "hook", "PostToolUse", "--akrctx-trace", "--akrctx-host", "claude"],
      "stdin": "{\"session_id\":\"unknown-order\",\"hook_event_name\":\"PostToolUse\",\"tool_name\":\"Bash\",\"tool_use_id\":\"validation-1\",\"tool_input\":{\"command\":\"npm test\"},\"tool_result\":{\"exit_code\":0}}"
    },
    {
      "command": ["$AKRCTX", "hook", "SessionEnd", "--akrctx-trace", "--akrctx-host", "claude"],
      "stdin": "{\"session_id\":\"unknown-order\",\"hook_event_name\":\"SessionEnd\"}"
    },
    {
      "command": ["$AKRCTX", "trace", "report", "--json"]
    }
  ],
  "assertions": [
    {
      "type": "exitCode",
      "step": 9,
      "equals": 0
    },
    {
      "type": "stdoutJsonPathEquals",
      "step": 9,
      "jsonPath": "sessions.0.capsuleBeforeFirstMutation",
      "equals": null
    },
    {
      "type": "stdoutJsonPathEquals",
      "step": 9,
      "jsonPath": "sessions.0.unclassifiedShellBeforeBinding",
      "equals": 1
    },
    {
      "type": "stdoutJsonPathEquals",
      "step": 9,
      "jsonPath": "totals.mutating",
      "equals": 1
    },
    {
      "type": "stdoutJsonPathEquals",
      "step": 9,
      "jsonPath": "totals.orderingUnknown",
      "equals": 1
    },
    {
      "type": "stdoutJsonPathEquals",
      "step": 9,
      "jsonPath": "totals.capsuleBound",
      "equals": 1
    },
    {
      "type": "stdoutJsonPathEquals",
      "step": 9,
      "jsonPath": "totals.capsuleComplete",
      "equals": 1
    },
    {
      "type": "stdoutJsonPathEquals",
      "step": 9,
      "jsonPath": "totals.validationDeclared",
      "equals": 1
    },
    {
      "type": "stdoutJsonPathEquals",
      "step": 9,
      "jsonPath": "totals.validationObserved",
      "equals": 1
    }
  ],
  "comparison": {
    "baseExpected": "fail",
    "candidateExpected": "pass"
  },
  "outcome": {
    "metric": "trace-classification-accuracy",
    "direction": "increase",
    "verdict": "inconclusive"
  }
}
